{
  "schema_version": "DISCOVERY_RELATIONSHIP_GRAPH_V1",
  "status": "PUBLIC_SAFE_LIVE_GRAPH_HYPOTHESES",
  "inventory_binding": {
    "observed_date": "2026-10-01",
    "total_count": 77,
    "all_names_sha256": "9c21a6fbf6c31ee413dfe05e07e41cde6e4f86603ba93f2bf3ff4f8c02065754"
  },
  "nodes": [
    {
      "id": "Attune",
      "kind": "REPOSITORY",
      "privacy": "PUBLIC",
      "labels": [
        "RELATIONSHIP_PRODUCT",
        "DOMAIN_NEGATIVE_CONTROL"
      ],
      "notes": [
        "Product thesis explicitly treats identity/continuity/relationship semantics as product-owned rather than generic substrate."
      ]
    },
    {
      "id": "RepairTracker",
      "kind": "REPOSITORY",
      "privacy": "PUBLIC",
      "labels": [
        "UNCLASSIFIED_CURRENTNESS_INTAKE"
      ],
      "notes": [
        "Publicly visible in the 2026-09-29 inventory; this currentness refresh infers no architectural role."
      ]
    },
    {
      "id": "WorkBridgeMCP",
      "kind": "REPOSITORY",
      "privacy": "PUBLIC",
      "labels": [
        "WORKSTATION_BRIDGE",
        "RUNTIME_BOUNDARY_CANDIDATE"
      ],
      "notes": [
        "Workstation implementation/qualification source containing a bounded native Go path and a separate exact Desktop Commander duplicate path; source presence does not establish installation or runtime consumption."
      ]
    },
    {
      "id": "abil",
      "kind": "REPOSITORY",
      "privacy": "PUBLIC",
      "labels": [
        "INDUSTRIAL_DIAGNOSTICS",
        "BROWNFIELD_ADAPTATION"
      ],
      "notes": [
        "Public anchor for the industrial diagnostic/reconstruction chain."
      ]
    },
    {
      "id": "axle",
      "kind": "REPOSITORY",
      "privacy": "PUBLIC",
      "labels": [
        "UNCLASSIFIED_CURRENTNESS_INTAKE"
      ],
      "notes": [
        "Publicly visible in the 2026-09-29 inventory; this currentness refresh infers no architectural role."
      ]
    },
    {
      "id": "bt2",
      "kind": "REPOSITORY",
      "privacy": "PUBLIC",
      "labels": [
        "COGNITIVE_BASE_CANDIDATE",
        "REUSABLE_HC_TEMPLATE"
      ],
      "notes": [
        "README describes this repository as the canonical reusable HC-series Hyperconnectome template."
      ]
    },
    {
      "id": "bugops",
      "kind": "REPOSITORY",
      "privacy": "PUBLIC",
      "labels": [
        "UNCLASSIFIED_CURRENTNESS_INTAKE"
      ],
      "notes": [
        "Publicly visible in the 2026-09-29 inventory; this currentness refresh infers no architectural role."
      ]
    },
    {
      "id": "build-team-2.0",
      "kind": "REPOSITORY",
      "privacy": "PUBLIC",
      "labels": [
        "UNCLASSIFIED_CURRENTNESS_INTAKE"
      ],
      "notes": [
        "Publicly visible in the 2026-09-29 inventory; this currentness refresh infers no architectural role."
      ]
    },
    {
      "id": "ccb-core",
      "kind": "REPOSITORY",
      "privacy": "PUBLIC",
      "labels": [
        "UNCLASSIFIED_CURRENTNESS_INTAKE"
      ],
      "notes": [
        "Publicly visible in the 2026-09-29 inventory; this currentness refresh infers no architectural role."
      ]
    },
    {
      "id": "conations",
      "kind": "REPOSITORY",
      "privacy": "PUBLIC",
      "labels": [
        "UNCLASSIFIED_CURRENTNESS_INTAKE"
      ],
      "notes": [
        "Publicly visible in the 2026-09-29 inventory; this currentness refresh infers no architectural role."
      ]
    },
    {
      "id": "deepmemorystorage",
      "kind": "REPOSITORY",
      "privacy": "PUBLIC",
      "labels": [
        "UNCLASSIFIED_CURRENTNESS_INTAKE"
      ],
      "notes": [
        "Publicly visible in the 2026-09-29 inventory; this currentness refresh infers no architectural role."
      ]
    },
    {
      "id": "discovery",
      "kind": "REPOSITORY",
      "privacy": "PUBLIC",
      "labels": [
        "META_EVALUATOR"
      ],
      "notes": [
        "Discovery itself remains subject to hostile review."
      ]
    },
    {
      "id": "driftguard",
      "kind": "REPOSITORY",
      "privacy": "PUBLIC",
      "labels": [
        "RUNTIME_CONTROL_CANDIDATE"
      ],
      "notes": []
    },
    {
      "id": "empathy",
      "kind": "REPOSITORY",
      "privacy": "PUBLIC",
      "labels": [
        "UNCLASSIFIED_CURRENTNESS_INTAKE"
      ],
      "notes": [
        "Publicly visible in the 2026-09-29 inventory; this currentness refresh infers no architectural role."
      ]
    },
    {
      "id": "executor",
      "kind": "REPOSITORY",
      "privacy": "PUBLIC",
      "labels": [
        "UNCLASSIFIED_CURRENTNESS_INTAKE"
      ],
      "notes": [
        "Current main is bootstrap-only. Draft PR #1 proposes a full-authority remote-execution implementation; candidate semantics are not promoted into current-main classification."
      ]
    },
    {
      "id": "freerowcochkar",
      "kind": "REPOSITORY",
      "privacy": "PUBLIC",
      "labels": [
        "UNCLASSIFIED_CURRENTNESS_INTAKE"
      ],
      "notes": [
        "Publicly visible in the 2026-09-29 inventory; this currentness refresh infers no architectural role."
      ]
    },
    {
      "id": "fuckup",
      "kind": "REPOSITORY",
      "privacy": "PUBLIC",
      "labels": [
        "UNCLASSIFIED_CURRENTNESS_INTAKE"
      ],
      "notes": [
        "Publicly visible in the 2026-09-29 inventory; this currentness refresh infers no architectural role."
      ]
    },
    {
      "id": "god-brain",
      "kind": "REPOSITORY",
      "privacy": "PUBLIC",
      "labels": [
        "COGNITIVE_DERIVATIVE",
        "EXPERIMENT_SYSTEM"
      ],
      "notes": [
        "README states the repository was created from the hc-brain template and has independent project history."
      ]
    },
    {
      "id": "hc-brain",
      "kind": "REPOSITORY",
      "privacy": "PUBLIC",
      "labels": [
        "COGNITIVE_BASE_CANDIDATE"
      ],
      "notes": []
    },
    {
      "id": "hephaestus",
      "kind": "REPOSITORY",
      "privacy": "PUBLIC",
      "labels": [
        "UNCLASSIFIED_CURRENTNESS_INTAKE"
      ],
      "notes": [
        "Publicly visible in the 2026-09-29 inventory; this currentness refresh infers no architectural role."
      ]
    },
    {
      "id": "ingest",
      "kind": "REPOSITORY",
      "privacy": "PUBLIC",
      "labels": [
        "UNCLASSIFIED_CURRENTNESS_INTAKE"
      ],
      "notes": [
        "Publicly visible in the 2026-09-29 inventory; this currentness refresh infers no architectural role."
      ]
    },
    {
      "id": "intranel",
      "kind": "REPOSITORY",
      "privacy": "PUBLIC",
      "labels": [
        "UNCLASSIFIED_CURRENTNESS_INTAKE"
      ],
      "notes": [
        "Publicly visible in the 2026-09-29 inventory; this currentness refresh infers no architectural role."
      ]
    },
    {
      "id": "lgcm",
      "kind": "REPOSITORY",
      "privacy": "PUBLIC",
      "labels": [
        "UNCLASSIFIED_CURRENTNESS_INTAKE"
      ],
      "notes": [
        "Publicly visible in the 2026-09-29 inventory; this currentness refresh infers no architectural role."
      ]
    },
    {
      "id": "masamune",
      "kind": "REPOSITORY",
      "privacy": "PUBLIC",
      "labels": [
        "UNCLASSIFIED_CURRENTNESS_INTAKE"
      ],
      "notes": [
        "Publicly visible in the 2026-09-29 inventory; this currentness refresh infers no architectural role."
      ]
    },
    {
      "id": "meso-crct",
      "kind": "REPOSITORY",
      "privacy": "PUBLIC",
      "labels": [
        "UNCLASSIFIED_CURRENTNESS_INTAKE"
      ],
      "notes": [
        "Publicly visible in the 2026-09-29 inventory; this currentness refresh infers no architectural role."
      ]
    },
    {
      "id": "mosaic",
      "kind": "REPOSITORY",
      "privacy": "PUBLIC",
      "labels": [
        "EXPERIMENT_SYSTEM"
      ],
      "notes": []
    },
    {
      "id": "noema",
      "kind": "REPOSITORY",
      "privacy": "PUBLIC",
      "labels": [
        "COGNITIVE_RESEARCH",
        "PREDICTIVE_WORLD_MODEL"
      ],
      "notes": [
        "Research project for persistent predictive cognition; architecture remains unapproved."
      ]
    },
    {
      "id": "on-theo",
      "kind": "REPOSITORY",
      "privacy": "PUBLIC",
      "labels": [
        "DOMAIN_NEGATIVE_CONTROL",
        "EVIDENCE_DISCIPLINE"
      ],
      "notes": []
    },
    {
      "id": "personification",
      "kind": "REPOSITORY",
      "privacy": "PUBLIC",
      "labels": [
        "UNCLASSIFIED_CURRENTNESS_INTAKE"
      ],
      "notes": [
        "Publicly visible in the 2026-09-29 inventory; this currentness refresh infers no architectural role."
      ]
    },
    {
      "id": "pre-active",
      "kind": "REPOSITORY",
      "privacy": "PUBLIC",
      "labels": [
        "UNCLASSIFIED_CURRENTNESS_INTAKE"
      ],
      "notes": [
        "Same GitHub repository identity formerly addressed as pro-run (repository id 1387754784); renamed to pre-active. Rename continuity does not imply a new role."
      ]
    },
    {
      "id": "project-achilles",
      "kind": "REPOSITORY",
      "privacy": "PUBLIC",
      "labels": [
        "UNCLASSIFIED_CURRENTNESS_INTAKE"
      ],
      "notes": [
        "Publicly visible in the 2026-09-29 inventory; this currentness refresh infers no architectural role."
      ]
    },
    {
      "id": "project-lantern",
      "kind": "REPOSITORY",
      "privacy": "PUBLIC",
      "labels": [
        "UNCLASSIFIED_CURRENTNESS_INTAKE"
      ],
      "notes": [
        "Publicly visible in the 2026-09-29 inventory; this currentness refresh infers no architectural role."
      ]
    },
    {
      "id": "project-runner",
      "kind": "REPOSITORY",
      "privacy": "PUBLIC",
      "labels": [
        "EXECUTION_ORCHESTRATION"
      ],
      "notes": []
    },
    {
      "id": "rezon",
      "kind": "REPOSITORY",
      "privacy": "PUBLIC",
      "labels": [
        "EPISTEMIC_REASONING"
      ],
      "notes": []
    },
    {